Sheet: Sheet1
B2: Strength | C2: Dexterity | D2: Intelligence | E2: Perception
B3: 6 | C3: 4 | D3: 1 | E3: 4
A5: Weapon Damage | B5: 2
A6: Weapon Acc. | B6: 2
A7: Hack Strength | B7: 2
A8: Armour | B8: 4
B10: Total:
A11: Melee dmg + | B11: of:=SUM([.B3]/2;[.B5]) -> 5
A12: Melee to hit | B12: of:=SUM([.B6];[.C3];([.E3]/2)) -> 8
A13: Critical hit | B13: of:=SUM(([.C3]/2);([.E3]/2)) -> 4
A14: Ranged to hit + | B14: of:=SUM([.B6];([.C3]/4);[.E3]) -> 7
A15: Hack strength + | B15: of:=SUM([.B7];[.D3];([.E3]/3)) -> 4.33333333333333
A16: Hack Cap | B16: of:=SUM([.D3]) -> 1
A17: Defense + | B17: of:=SUM([.B8];([.A4]/3)) -> 4
A18: Dodge | B18: of:=SUM([.C3]/2;[.E3]/2) -> 4